word|definition|part of speech|example
aberrant|markedly different from an accepted norm.|adjective|When the financial director started screaming and throwing food at his co-workers, the police had to come in to deal with his aberrant behavior.
aberration|a deviation from what is normal or expected.|noun|Aberrations in climate have become the norm: rarely a week goes by without some meteorological phenomenon making headlines.
abstain|choose not to consume or take part in (particularly something enjoyable) Considered a health nut, Jessica abstained from anything containing sugar--even chocolate.|verb|abstain - No example found
abstruse|difficult to understand; incomprehensible.|adjective|Physics textbooks can seem so abstruse to the uninitiated that readers feel as though they are looking at hieroglyphics.
adamant|refusing to change one's mind.|adjective|Civil rights icon Rosa Parks will forever be remembered for adamantly refusing to give up her seat on a public bus--even after the bus driver insisted, she remained rooted in place.
admonish|to warn strongly, even to the point of reprimanding.|verb|Before the concert began, security personel admonished the crowd not to come up on stage during the performance.
admonitory|serving to warn; expressing reproof or reproach especially as a corrective.|adjective|At the assembly, the high school vice-principal gave the students an admonitory speech, warning them of the many risks and dangers of prom night.
aesthete|one who professes great sensitivity to the beauty of art and nature.|noun|A true aesthete, Marty would spend hours at the Guggenheim Museum, staring at the same Picasso.
aesthetic|concerned with the appreciation of beauty.|adjective|The director, not known for his aesthetic sensibilities, decided not to use costumes at all, and put on the play in everyday clothing.
aesthetic|a set of principles underlying and guiding the work of a particular artist or artistic movement.|noun|The artist operated according to a peculiar aesthetic, not considering any photograph to be worth publishing unless it contained a marine mammal.
amalgam|a mixture of multiple things.|noun|The band's music was an amalgam of hip-hop, flamenco and jazz, blending the three styles with surprising results.
ambiguous|open to more than one interpretation.|adjective|"The coach told his team, ""Move towards that side of the field""; because he did not point, his directions were ambiguous, and the team had no idea to which side he was referring."
ambivalent|mixed or conflicting emotions about something.|adjective|Sam was ambivalent about studying for the exam because doing so ate up a lot of his time, yet he was able to improve his analytical skills.
ameliorate|make something bad better.|verb|Three Cups of Tea tells the story of western man who hopes to ameliorate poverty and the lack of education in Afghanistan.
amenable|easily persuaded.|adjective|Even though she did not like the outdoors, Shirley was generally amenable and so her brother was able to persuade her to go camping.
amorphous|shapeless.|adjective|His study plan for the GRE was at best amorphous; he would do questions from random pages in any one of seven test prep books.
anomalous|not normal.|adjective|According to those who do not believe in climate change, the extreme weather over the last five years is simply anomalous--average temps should return to average, they believe.
anomaly|something that is not normal, standard, or expected.|noun|After finding an anomaly in the data, she knew that she would have to conduct her experiment again.
antipathy|an intense feeling of dislike or aversion.|noun|Maria had an antipathy for tour groups, often bolting to the other side of the museum as soon as she saw a chaperone leading a group of wide-eyed tourists.
antithetical|sharply contrasted in character or purpose.|adjective|His deep emotional involvement with these ideas is, in fact, antithetical to the disattachment Buddhism preaches.
apathetic|marked by a lack of interest.|adjective|Mr. Thompson was so talented at teaching math that even normally apathetic students took interest.
apathy|an absence of emotion or enthusiasm.|noun|Widespread apathy among voters led to a very small turnout on election day.
apocryphal|being of questionable authenticity.|adjective|The web is notorious for sandwiching apocryphal stories between actual news.
appease|pacify by acceding to the demands of.|verb|Neville Chamberlain, the British prime minister during WWII, tried to appease Hitler and in doing so sent a clear message: you can walk all over us.
arbitrary|based on a random, groundless decision.|adjective|One of the arbitrary decrees in place during the emperor's rule is that all citizens pay him weekly homage at his palace. This word has other definitions but this is the most important one for the GRE.
arcane|requiring secret or mysterious knowledge.|adjective|Most college fraternities are known for arcane rituals that those hoping to the join the fraterntiy must learn.
arduous|demanding considerable mental effort and skill; testing powers of endurance In order to deal with the arduous cross-country journey, truck drivers often survive on a string of caffeinated drinks, staying awake for up to 30 hours at a time.|adjective|arduous - No example found
artful|exhibiting artistic skill.|adjective|Picasso is generally considered the most artful member of the Cubist movement.
artful|clever in a cunning way.|adjective|Bernie Madoff's artful Ponzi scheme stole billions of dollars from investors and is considered the largest financial fraud in U.S. history.
ascetic|practicing self-denial.|adjective|His ascetic life is the main reason he inspired so many followers, especially since he gave up wealth and power to live in poverty.
ascetic|one who practices great self-denial.|noun|Historically, ascetics like Ghandi are often considered wise men partially because of their restraint.
askance|with a look of suspicion or disapproval.|adverb|"The old couple looked askance on the teenagers seated next to them, whispering to each other, ""They've got rings through their noses and purple hair!""."
audacious|willing to be bold in social situations or to take risks.|adjective|As all of the other campers cowered in their tents, Bill, armed only with a flashlight, audaciously tracked down the bear that had raided their food.
audacity|aggressive boldness in social situations.|noun|She surprised her colleagues by having the audacity to publically criticize the findings of an distinguished scientist.
auspicious|favorable, the opposite of sinister.|adjective|Despite an auspicious beginning, Mike's road trip became a series of mishaps, and he was soon stranded and penniless, leaning against his wrecked automobile.
austere|practicing self-denial.|adjective|His lifestyle of revelry and luxurious excess could hardly be called austere.
austere|unadorned in style or appearance.|adjective|Late Soviet architecture, although remaining largely austere, moved into experimental territory that employed previously unused shapes and structures.
austere|harsh in manner of temperament.|adjective|The principal of my elementary school was a cold, austere woman; I could never understand why she chose to work with children.
avaricious|excessively greedy.|adjective|Since avaricious desire is similar to gluttony or lust--sins of excess--it was listed as one of the seven deadly sins by the Catholic church.
banal|repeated too often; overfamiliar through overuse.|adjective|The professor used such banal expression that many students in the class either fell asleep from bordeom or stayed awake to complete his sentences and humor friends.
banality|a trite or obvious remark.|noun|Herbert regarded the minister's remark as a mere banality until Sharon pointed out profound implications to the seemingly obvious words.
belie|to give a false representation to; misrepresent.|verb|The smile on her face belies the pain she must feel after the death of her husband.
belligerent|characteristic of one eager to fight.|adjective|Tom said that he was arguing the matter purely for philosophical reasons, but his belligerent tone indicated an underlying anger about the issue.
betray|to reveal or make known something, usually unintentionally.|verb|With the gold medal at stake, the gymnast awaited his turn, his quivering lip betraying his intense emotions.
blatant|without any attempt at concealment; completely obvious Allen was often punished in school for blatantly disrespecting teachers.|adjective|blatant - No example found
bolster|support and strengthen.|verb|The case for the suspect's innocence was bolstered considerably by the fact that neither fingerprints nor DNA were found at the scene. This word has other definitions but this is the most important one for the GRE.
brazen|unrestrained by convention or propriety.|adjective|"Their large ""donations"" to the local police department gave the drug cartel the brazen confidence to do their business out in the open."
bucolic|relating to the pleasant aspects of the country.|adjective|The noble families of England once owned vast expanses of beautiful, bucolic land.
bumbling|lacking physical movement skills, especially with the hands Within a week of starting, the bumbling new waiter was unceremoniously fired.|adjective|bumbling - No example found
burgeon|grow and flourish.|verb|China's housing market is burgeoning, but some predict that the growth is merely a bubble and will burst much like the U.S. real estate bubble of 2008.
calumny|"making of a false statement meant to injure a person""s reputation."|noun|With the presidential primaries well under way, the air is thick with calumny, and the mud already waist- high.
capricious|determined by chance or impulse or whim rather than by necessity or reason Nearly every month our capricious CEO had a new plan to turn the company around, and none of them worked because we never gave them the time they needed to succeed.|adjective|capricious - No example found
castigate|to reprimand harshly.|verb|Drill sergeants are known to castigate new recruits so mercilessly that the latter often break down during their first week in training.
censure|to express strong disapproval.|verb|After being caught in bed with a mistress, the mayor was quickly censured by the city council.
chastise|to reprimand harshly.|verb|Though chastised for his wanton abuse of the pantry, Lawrence shrugged off his mother's harsh words, and continued to plow through jars of cookies and boxes of donuts.
chortle|to chuckle, laugh merrily.|verb|Walking past the bar, I could hear happy, chortling people and the blast of horns from a jazz band.
circumscribe|restrict or confine.|verb|Their tour of South America was circumscribed so that they saw only popular destinations and avoided the dangerous parts of cities. This word has other definitions but this is the most important one for the GRE.
circumvent|cleverly find a way out of one's duties or obligations.|verb|One way of circumventing the GRE is to apply to a grad school that does not require GRE scores.
commensurate|to be in proportion or corresponding in degree or amount The convicted felon's life sentence was commensurate to the heinousness of his crime.|adjective|commensurate - No example found
concede|acknowledge defeat I concede.|verb|You win!.
concede|admit (to a wrongdoing).|verb|After a long, stern lecture from her father, Olivia conceded to having broken the window.
concede|give over; surrender or relinquish to the physical control of another.|verb|The Spanish were forced to concede much of the territory they had previously conquered.
confound|be confusing or perplexing to.|verb|Though Harry loved numbers, he found calculus confounding.
confound|mistake one thing for another.|verb|Americans often confound sweet potatoes with yams, and refer to both vegetables by the same name.
conspicuous|without any attempt at concealment; completely obvious.|adjective|American basketball players are always conspicuous when they go abroad--not only are they American, but some are over seven feet tall.
constituent|a citizen who is represented in a government by officials for whom he or she votes The mayor's constituents are no longer happy with her performance and plan to vote for another candidate in the upcoming election.|noun|constituent - No example found
constituent|an abstract part of something.|noun|The constituents of the metal alloy are nickle, copper, and tin.
construe|interpreted in a particular way.|verb|The author's inability to take a side on the issue was construed by both his opponents and supporters as a sign of weakness.
contingent|a gathering of persons representative of some larger group.|noun|A small contingent of those loyal to the king have gathered around the castle to defend it.
contingent|possible but not certain to occur.|adjective|Whether the former world champions can win again this year is contingent upon none of its star players getting injured.
contrition|the feeling of remorse or guilt that comes from doing something bad.|noun|Those who show contrition during their prison terms--especially when under review by a parole board-- often get shortened sentences.
contrive|to pull off a plan or scheme, usually through skill or trickery.|verb|Despite a low GPA, he contrived to get into college, going so far as to write his own glowing letters of recommendation. This word has other definitions but this is the most important one for the GRE.
copious|in abundant supply.|adjective|In midsummer, there are copious popiscle stands at the beach; in the winter, there are none.
craven|pathetically cowardly.|adjective|Though the man could have at least alerted the police, he crouched cravenly in the corner as the old woman was mugged.
cryptic|mysterious or vague, usually intentionally.|adjective|Since Sarah did not want her husband to guess the Christmas present she had bought him, she only answered cryptically when he would ask her questions about it.
culminate|reach the highest or most decisive point.|verb|Beethoven's musical genius culminated in the 9th Symphony, which many consider his greatest work.
culpability|a state of guilt.|noun|Since John had left his banana peel at the top of the stairwell, he accepted culpability for Martha's broken leg.
decorous|characterized by good taste in manners and conduct.|adjective|Sally's parties are decorous affairs, and instead of the usual beer and music, there is tea and intellectual conversation.
decorum|propriety in manners and conduct.|noun|You will obey the rules of decorum for this courtroom or spend the night in a jail cell, said the judge to the prosecutor.
deferential|showing respect.|adjective|If you ever have the chance to meet the president, stand up straight and be deferential.
deleterious|harmful to living things.|adjective|The BP oil spill in the Gulf of Mexico was deleterious to the fishing industry in the southern states.
delineate|describe in detail.|verb|After a brief summary of proper swimming technique, the coach delineated the specifics of each stroke, spending 30 minutes alone on the backstroke.
demur|to object or show reluctance.|verb|Wallace disliked the cold, so he demurred when his friends suggested they going skiing in the Alps.
denigrate|charge falsely or with malicious intent; attack the good name and reputation of someone.|verb|Count Rumford denigrated the new theory of heat, demonstrating that it was wholly inadequate to explain the observations.
denote|be a sign or indication of; have as a meaning.|verb|"Even if the text is not visible, the red octagon denotes ""stop"" to all motorists in America."
derivative|(or a creative product, e.|adjective|g. music, writing, etc.) not original but drawing on the work of another person. Because the movies were utterly derivative of other popular movies, they did well at the box office. This word has other definitions but this is the most important one for the GRE.
derive|come from; be connected by a relationship of blood, for example.|verb|"Many words in the English language are derived from Latin, including the word ""derive.""."
derive|reason by deduction; establish by deduction.|verb|From the multiple set of footprints in the living room, the investigator derived an important clue: Sheila was not alone in the room at the time of the murder.
dictatorial|expecting unquestioning obedience; characteristic of an absolute ruler The coach was dictatorial in his approach: no players could ever argue or question his approach.|adjective|dictatorial - No example found
didactic|instructive (especially excessively).|adjective|Tolstoy's The Death of Ivan Illyich is a didactic novel, instructing the reader on how to live a good life.
diffident|showing modest reserve; lacking self-confidence.|adjective|As a young girl she was diffident and reserved, but now as an adult, she is confident and assertive.
dilatory|wasting time.|adjective|Lawyers use dilatory tactics so that it takes years before the case is actually decided.
dilettante|an amateur who engages in an activity without serious intentions and who pretends to have knowledge.|noun|Fred has no formal medical training; while he likes to claim authority on medical issues, he is little more than a dilettante.
disaffected|discontented as toward authority.|adjective|After watching his superior take rations from the soliders, he quickly became disaffected and rebeled.
discrete|constituting a separate entity or part.|adjective|What was once known as Czechoslovakia has since split into two discrete, independent nations.
disinterested|unbiased; neutral.|adjective|The potential juror knew the defendant, and therefore could not serve on the jury, which must consist only of disinterested members.
dispassionate|unaffected by strong emotion or prejudice.|adjective|A good scientist should be dispassionate, focusing purely on what the evidence says, without personal attachment.
disseminate|cause to become widely known.|verb|Before the effects of anaethesia were disseminated, patients had to experience the full pain of a surgery.
dogmatic|highly opinionated, not accepting that your belief may not be correct.|adjective|Bryan is dogmatic in his belief that the earth is flat, claiming that all pictures of a spherical earth are computer generated.
duress|compulsory force or threat.|noun|The witness said he signed the contract under duress and argued that the court should cancel the agreement.
eclectic|comprised of a variety of styles.|adjective|"Joey was known for his eclectic tastes in music, one moment dancing to disco the next ""air conducting"" along to Beethoven's 9th symphony."
economical|avoiding waste, efficient.|adjective|Journalists favor an economical style of writing, in which no unnecessary words are used and every sentence is as short as possible.
edifying|enlightening or uplifting so as to encourage intellectual or moral improvement.|adjective|I recently read an article in the Times about whether good literature is edifying or not; specifically, does reading more make a person more moral.
efficacious|producing the intended result.|adjective|Since Maggie's cough syrup, which had expired five years back, was no longer efficacious, she coughed through the night.
egregious|standing out in negative way; shockingly bad.|adjective|The dictator's abuse of human rights was so egregious that many world leaders asked that he be tried in an international court for genocide.
elicit|call forth (emotions, feelings, and responses).|verb|Just smiling--even if you are depressed--can elicit feelings of pleasure and happiness.
elucidate|make clearer and easier to understand.|verb|Youtube is great place to learn just about anything--an expert elucidates finer points so that even a complete novice can learn.
eminent|standing above others in quality or position.|adjective|Shakespeare is an eminent author in the English language, but I find his writing uninteresting and melodramatic.
enervate|to sap energy from.|verb|John preferred to avoid equatorial countries; the intense sun would always leave him enervated after he'd spent the day sightseeing.
engender|give rise to.|verb|The restrictions of the Treaty of Versailles were so severe that they engendered deep hatred and resentment in the German people.
entrenched|fixed firmly or securely.|adjective|By the time we reach 60-years old, most of our habits are so entrenched that it is difficult for us to change.
ephemeral|lasting a very short time.|adjective|The lifespan of a mayfly is ephemeral, lasting from a few hours to a couple of days.
equivocal|confusing or ambiguous.|adjective|The findings of the study were equivocal--the two researchers had different opinions on what the results signified.
eradicate|to completely destroy.|verb|I tried eradicating the mosquitos in my apartment with a rolled up newspaper, but there were too many. of them.
erudite|having or showing profound knowledge.|adjective|Before the Internet, the library was typically were you would find erudite readers.
eschew|avoid and stay away from deliberately; stay clear of.|verb|Politicians are the masters of eschewing morals; academics are the masters of eschewing clarity.
esoteric|confined to and understandable by only an enlightened inner circle.|adjective|Map collecting is an esoteric hobby to most, but to geography geeks it is a highly enjoyable pasttime.
espouse|to adopt or support an idea or cause.|verb|As a college student, Charlie espoused Marxism, growing his beard out and railing against the evils of the free-market.
exacerbate|make worse.|verb|Her sleeplessness exacerbated her cold--when she woke up the next day, her sinuses were completely blocked.
exacting|requiring and demanding accuracy.|adjective|Though his childhood piano teacher was so exacting, Max is thankful now, as a professional pianist.
exalt|praise or glorify.|verb|The teenagers exalted the rock star, covering their bedrooms with posters of him.
exonerate|pronounce not guilty of criminal charges.|verb|The document clearly indicated that Nick was out of the state at the time of the crime, and so served to exonerate him of any charges.
expound|add details or explanation; clarify the meaning; state in depth.|verb|The CEO refused to expound on the decision to merge our department with another one, and so I quit.
extant|the opposite of extinct.|adjective|Despite many bookstores closing, experts predict that some form of book dealing will still be extant generations from now.
fallacious|of a belief that is based on faulty reasoning.|adjective|The widespread belief that Eskimos have forty different words for snow is fallacious, based on one false report.
fastidious|overly concerned with details; fussy.|adjective|Whitney is fastidious about her shoes, arranging them on a shelf in a specific order, each pair evenly spaced.
flux|a state of uncertainty about what should be done (usually following some important event) Ever since Elvira resigned as the head of marketing, everything about our sales strategy has been in a state of flux.|noun|flux - No example found
foment|try to stir up public opinion.|verb|After having his pay cut, Phil spread vicious rumors about his boss, hoping to foment a general feeling of discontent.
forlorn|marked by or showing hopelessness.|adjective|After her third pet dog died, Marcia was simply forlorn: this time even the possibility of buying a new dog no longer held any joy.
forthcoming|available when required or as promised.|adjective|The President announced that the senators were about to reach a compromise, and that he was eager to read the forthcoming details of the bill.
forthcoming|at ease in talking to others.|adjective|As a husband, Larry was not forthcoming: if Jill didn't demand to know details, Larry would never share them with her.
fortuitous|occurring by happy chance; having no cause or apparent cause.|adjective|While the real objects are vastly different sizes in space, the sun and the moon seem to have the same fortuitous size in the sky.
frivolous|not serious in content or attitude or behavior.|adjective|Compared to Juliet's passionate concern for human rights, Jake's non-stop concern about football seems somewhat frivolous.
frugal|not spending much money (but spending wisely).|adjective|Monte was no miser, but was simply frugal, wisely spending the little that he earned.
frustrate|hinder or prevent (the efforts, plans, or desires) of.|verb|I thought I would finish writing the paper by lunchtime, but a number of urgent interruptions served to frustrate my plan. This word has other definitions but this is the most important one for the GRE.
furtive|marked by quiet and caution and secrecy; taking pains to avoid being observed While at work, George and his boss Regina felt the need to be as furtive as possible about their romantic relationship.|adjective|furtive - No example found
gainsay|deny or contradict; speak against or oppose.|verb|I can't gainsay a single piece of evidence James has presented, but I still don't trust his conclusion.
gall|the trait of being rude and impertinent.|noun|Even though Carly was only recently hired, she had the gall to question her boss's judgment in front of the office.
gall|feeling of deep and bitter anger and ill-will.|noun|In an act of gall, Leah sent compromising photos of her ex-boyfriend to all his co-workers and professional contacts.
galvanize|to excite or inspire (someone) to action.|verb|"At mile 23 of his first marathon, Kyle had all but given up, until he noticed his friends and family holding a banner that read, ""Go Kyle""; galvanized, he broke into a gallop, finishing the last three miles in less than 20 minutes."
garrulous|full of trivial conversation.|adjective|Lynne was garrulous: once, she had a fifteen minute conversation with a stranger before she realized the woman didn't speak English.
