word|definition|part of speech|example
sanction|a legal penalty for a forbidden action.|noun|International sanctions have been placed on certain shipping lanes that were thought to be involved in human trafficking.
scrupulous|characterized by extreme care and great effort.|adjective|Because of his scrupulous nature, Mary put him in charge of numbering and cataloging the entire collection of rare stamps.
scrupulous|having a sense of right and wrong; principled.|adjective|Everyone trusted what he said and followed his example because he was scrupulous and honest.
soporific|inducing mental lethargy; sleep inducing.|adjective|Although the professor is brilliant, his bland monotone gives his lectures a soporific effect.
specious|based on pretense; deceptively pleasing Almost every image on TV is specious and not to be trusted.|adjective|specious - No example found
specious|plausible but false.|adjective|He made a career out of specious arguments and fictional lab results, but lost his job and reputation when his lies were exposed by an article in The New York Times.
sporadic|recurring in scattered and irregular or unpredictable instances.|adjective|The signals were at first sporadic, but now we detect a clear, consistent pattern of electromagnetic radiation eminating from deep space.
spurious|plausible but false.|adjective|When listening to a politician speak, it is hard to distinguish the spurious claims from the authentic ones.
staunch|firm and dependable especially in loyalty.|adjective|No longer a staunch supporter of the movement, Todd now will openly question whether its goals are worthwhile.
stringent|demanding strict attention to rules and procedures.|adjective|Most of the students disliked the teacher because of his stringent homework policy, but many students would later thank him for demanding so much from them.
subsume|contain or include.|verb|The rogue wave quickly subsumed the pier and boardwalk, destroying everything in its path.
subsume|consider (an instance of something) as part of a general rule or principle.|verb|Don Quixote of La Mancha subsumes all other modern novels, demonstrating modern literary devices. and predating even the idea of a postmodern, metanarrative.
subversive|in opposition to a civil authority or government.|adjective|"The ruling political party has begun a campaign to shut down subversive websites that it deems as a threat to ""national safety.""."
sullen|showing a brooding ill humor.|adjective|Herbert took board games too seriously, often appearing sullen after losing.
superfluous|serving no useful purpose.|adjective|How can we hope to stay open if we don't eliminate all superfluous spending, like catered meetings and free acupucture Tuesday?.
superfluous|more than is needed, desired, or required Everything in this closet is superfluous and can be given to charity.|adjective|superfluous - No example found
supplant|take the place or move into the position of.|verb|For many, a cell phone has supplanted a traditional phone; in fact, most 20-somethings don't even have a traditional phone anymore.
sycophant|a person who tries to please someone in order to gain a personal advantage The CEO was unaware of the damaging consequences of his choices, largely because he surrounded himself with sycophants who would never dare criticize him.|noun|sycophant - No example found
taciturn|habitually reserved and uncommunicative.|adjective|While the CEO enthusiastically shares his plans and agenda with all who will listen, the CFO is far more taciturn, rarely revealing his perspective.
tantamount|being essentially equal to something.|adjective|In many situations, remaining silent is tantamount to admitting guilt, so speak to prove your innocence.
temperance|the trait of avoiding excesses.|noun|Welles wasn't known for his temperance--he usually ate enough for two and drank enough for three.
tempered|moderated in effect.|adjective|The wide-eyed optimism of her youth was now tempered after she had worked many years in the criminal justice system.
tenacious|stubbornly unyielding.|adjective|Even the most tenacious advocates for gun ownership must admit some of the dangers that firearms present.
timorous|timid by nature or revealing fear and nervousness.|adjective|Since this was her first time debating on stage and before an audience, Di's voice was timorous and quiet for the first 10 minutes.
torpor|inactivity resulting from lethargy and lack of vigor or energy.|noun|After work, I was expecting my colleagues to be enthusiastic about the outing, but I found them in a state of complete torpor.
tortuous|marked by repeated turns and bends; not straightforward.|adjective|Because the logic behind McMahon's side of the debate was so tortuous, his audience came out either completely confused or, worse, feeling they'd been tricked.
tractable|readily reacting to suggestions and influences; easily managed (controlled or taught or molded).|adjective|Compared to middle school students, who have an untamed wildness about them, high school students are somewhat more tractable.
transient|lasting a very short time.|adjective|The unpredictable and transient nature of deja vu makes it a very difficult phenomenon to study properly.
travesty|an absurd presentation of something; a mockery.|noun|What I expected to be an intelligent, nuanced historical documentary turned out to be a poorly-produced travesty of the form.
treacherous|tending to betray.|adjective|Even though Jesse James was an outlaw, his killer, Robert Ford, is remembered more for his treacherous actions than for eliminating a criminal and murder.
treacherous|dangerously unstable and unpredictable.|adjective|The bridge built from twine and vine is treacherous to walk across, and so I think I will stay put right here.
trite|repeated too often; overfamiliar through overuse.|adjective|Many style guides recommend not using idioms in writing because these trite expressions are uninteresting and show a lack of imagination on the part of the writer.
truncate|reduce the length of something.|verb|The soccer game was truncated when the monsoon rain began to fall.
undermine|to weaken (usually paired with an abstract term).|adjective|The student undermined the teacher's authority by questioning the teacher's judgment on numerous occasions.
underscore|give extra weight to (a communication).|verb|While the hiking instructor agreed that carrying a first aid kit could be a good idea under certain circumstances, he underscored the importance of carrying enough water.
unequivocal|admitting of no doubt or misunderstanding; having only one meaning or interpretation and leading to only one conclusion.|adjective|The President's first statement on the subject was vague and open to competing interpretations, so when he spoke to Congress about the same subject later, he was cafeful to make his position completely unequivocal.
unscrupulous|without scruples or principles.|adjective|In the courtroom, the lawyer was unscrupulous, using every manner of deceit and manipulation to secure a victory for himself.
upbraid|to reproach; to scold.|verb|"Bob took a risk walking into the ""Students Barbershop""--in the end he had to upbraid the apparently drunk barber for giving him an uneven bowl cut."
vacillate|be undecided about something; waver between conflicting positions or courses of action.|verb|Some students vacillate between schools when deciding which to attend, while others focus only on one school. This word has other definitions but this is the most important one for the GRE.
vehement|marked by extreme intensity of emotions or convictions.|adjective|While the other employees responded to the bad news in a measured way, Andrew responded in a vehement manner, tipping over his desk and shouting at the top of his lungs.
venality|the condition of being susceptible to bribes or corruption.|noun|Even some of the most sacrosanct sporting events are not immune to venality, as many of the officials have received substantial bribes to make biased calls.
venerate|to respect deeply.|verb|The professor, despite his soporific lectures, was venerated amongst his colleagues, publishing more papers yearly than all of his peers combined.
veracious|truthful.|adjective|While we elect our leaders in the hope that every word they speak will be veracious, history has shown that such a hope is naive.
vilify|spread negative information about.|verb|Todd was noble after the divorce, choosing to say only complimentary things about Barbara, but Barbara did not hesitate to vilify Todd.
vindicate|to clear of accusation, blame, suspicion, or doubt with supporting arguments or proof Even seven Tour de France wins cannot vindicate Lance Armstrong in the eyes of the public--that the athlete used performance enhancing drugs invalidates all those wins.|verb|vindicate - No example found
vociferous|conspicuously and offensively loud; given to vehement outcry.|adjective|In giving Marcia a particular vociferous response, Paul caused people at every other table in the restaurant to turn around an look at them angrily.
volubility|the quality of talking or writing easily and continuously.|noun|The professor's volubility knows no bounds; he could talk through a hurricane and elaborate a point from one St. Patrick's Day to the next.
wanting|lacking.|adjective|She did not think her vocabulary was wanting, yet there were so many words that inevitably she found a few she didn't know.
winsome|charming in a childlike or naive way.|adjective|She was winsome by nature, and many people were drawn to this free and playful spirit. Basic Words.
