word|definition|part of speech|example
gauche|lacking social polish.|adjective|Sylvester says the most gauche things, such as telling a girl he liked that she was much prettier when she wore makeup.
germane|relevant and appropriate.|adjective|The professor wanted to tell the jury in detail about his new book, but the lawyer said it wasn't germane to the charges in the cases.
glut|an excessive supply.|noun|The Internet offers such a glut of news related stories that many find it difficult to know which story to read first.
glut|supply with an excess of.|verb|In the middle of economic crises, hiring managers find their inboxes glutted with resumes.
gossamer|characterized by unusual lightness and delicacy.|adjective|The gossamer wings of a butterfly, which allow it to fly, are also a curse, so delicate that they are often damaged.
gregarious|to be likely to socialize with others.|adjective|Often we think that great leaders are those who are gregarious, always in the middle of a large group of people; yet, as Mahatma Gandhi and many others have shown us, leaders can also be introverted.
guileless|free of deceit.|adjective|At first I thought my niece was guileless, but I then found myself buying her ice cream every time we passed a shop.
hackneyed|lacking significance through having been overused.|adjective|"Cheryl rolled her eyes when she heard the lecturer's hackneyed advice to ""be true to yourself.""."
haphazard|marked by great carelessness; dependent upon or characterized by chance Many golf courses are designed with great care, but the greens on the county golf course seem entirely haphazard.|adjective|haphazard - No example found
harangue|a long pompous speech; a tirade.|noun|Dinner at Billy's was more a punishment than a reward, since anyone who sat at the dinner table would have to listen to Billy's father's interminable harangues against the government.
harangue|to deliver a long pompous speech or tirade.|verb|Tired of his parents haranguing him about his laziness and lack of initiative, Tyler finally moved out of home at the age of thirty-five.
harried|troubled persistently especially with petty annoyances.|adjective|With a team of new hires to train, Martha was constantly harried with little questions and could not focus on her projects.
haughty|having or showing arrogant superiority to and disdain of those one views as unworthy.|adjective|The haughty manager didn't believe that any of his subordinates could ever have an insight as brilliant his own.
hegemony|dominance over a certain area.|adjective|Until the Spanish Armada was defeated in 1587, Spain had hegemony over the seas, controlling waters stretching as far as the Americas.
heretic|a person who holds unorthodox opinions in any field (not merely religion).|noun|Though everybody at the gym told Mikey to do cardio before weights, Mikey was a heretic and always did the reverse.
iconoclast|somebody who attacks cherished beliefs or institutions.|noun|"Lady Gaga, in challenging what it means to be clothed, is an iconoclast for wearing a ""meat dress"" to a prominent awards show."
iconoclastic|defying tradition or convention.|adjective|Jackson Pollack was an iconoclastic artist, totally breaking with tradition by splashing paint on a blank canvas.
idiosyncrasy|a behavioral attribute that is distinctive and peculiar to an individual.|noun|Peggy's numerous idiosyncrasies include wearing mismatched shoes, laughing loudly to herself, and. owning a pet aardvark.
ignoble|dishonorable.|adjective|In the 1920s, the World Series was rigged--an ignoble act which baseball took decades to recover from.
ignominious|(used of conduct or character) deserving or bringing disgrace or shame.|adjective|Since the politician preached ethics and morality, his texting of revealing photographs was ignominious, bringing shame on both himself and his party.
immutable|not able to be changed.|adjective|Taxes are one of the immutable laws of the land, so there is no use arguing about paying them.
impartial|free from undue bias or preconceived opinions.|adjective|The judge was not impartial since he had been bribed by the witness's family.
impertinent|being disrespectful; improperly forward or bold.|adjective|Dexter, distraught over losing his pet dachshund, Madeline, found the police officer's questions impertinent--after all, he thought, did she have to pry into such details as to what Madeline's favorite snack was?.
implacable|incapable of making less angry or hostile.|adjective|Win or lose, the coach was always implacable, never giving the athletes an easy practice or a break.
implausible|describing a statement that is not believable.|adjective|The teacher found it implausible that the student was late to school because he had been kidnapped by outlaws on horseback.
imprudent|not wise.|adjective|Hitler, like Napoleon, made the imprudent move of invading Russia in winter, suffering even more casualties than Napoleon had.
impudent|improperly forward or bold.|adjective|In an impudent move, the defendant spoke out of order to say terribly insulting things to the judge.
incisive|having or demonstrating ability to recognize or draw fine distinctions.|adjective|The lawyer had an incisive mind, able in a flash to dissect a hopelessly tangled issue and isolate the essential laws at play.
incongruous|lacking in harmony or compatibility or appropriateness.|adjective|The vast economic inequality of modern society is incongruous with America's ideals.
incorrigible|impervious to correction by punishment.|adjective|Tom Sawyer seems like an incorrigible youth until Huck Finn enters the novel; even Sawyer can't match. his fierce individual spirit.
indecorous|not in keeping with accepted standards of what is right or proper in polite society.|adjective|Eating with elbows on the table is considered indecorous in refined circles.
indifference|the trait of seeming not to care.|noun|In an effort to fight indifference, the president of the college introduced a new, stricter grading system.
inexorable|impossible to stop or prevent.|adjective|The rise of the computer was an inexorable shift in technology and culture.
ingenuous|to be naÃ ̄ve and innocent.|adjective|Two-years in Manhattan had changed Jenna from an ingenuous girl from the suburbs to a jaded urbanite, unlikely to fall for any ruse, regardless of how elaborate.
ingratiate|gain favor with somebody by deliberate efforts.|verb|Even though Tom didn't like his new boss, he decided to ingratiate himself to her in order to advance his career.
inimical|hostile (usually describes conditions or environments).|adjective|Venus, with a surface temperature that would turn rubber to liquid, is inimical to any form of life.
innocuous|"harmless and doesn""t produce any ill effects."|adjective|Everyone found Nancy's banter innocuous--except for Mike, who felt like she was intentionally picking on him.
inscrutable|not easily understood; unfathomable.|adjective|His speech was so dense and confusing that many in the audience found it inscrutable.
insidious|working in a subtle but destructive way.|adjective|Plaque is insidious: we cannot see it, but each day it eats away at our enamel, causing cavities and other dental problems.
insolent|rude and arrogant.|adjective|Lilian could not help herself from being insolent, commenting that the Queen's shoes were showing too much toe.
intimate|to suggest something subtly.|verb|At first Manfred's teachers intimated to his parents that he was not suited to skip a grade; when his parents protested, teachers explicitly told them that, notwithstanding the boy's precocity, he was simply too immature to jump to the 6th grade. This word has other definitions but this is the most important one for the GRE.
intransigent|unwilling to change one's beliefs or course of action.|adjective|Despite many calls for mercy, the judge remained intransigent, citing strict legal precedence.
intrepid|fearless.|adjective|Captain Ahab was an intrepid captain whose reckless and fearless style ultimate leads to his downfall.
inveterate|habitual.|adjective|He is an inveterate smoker and has told his family and friends that there is no way he will ever quit.
involved|complicated, and difficult to comprehend.|adjective|The physics lecture became so involved that the undergraduate's eyes glazed over.
irrevocable|incapable of being retracted or revoked.|adjective|Once you enter your plea to the court, it is irrevocable so think carefully about what you will say.
itinerant|traveling from place to place to work Doctors used to be itinerant, traveling between patients' homes.|adjective|itinerant - No example found
jingoism|fanatical patriotism.|noun|North Korea maintains intense control over its population through a combination of jingoism and cult of personality.
jovial|full of or showing high-spirited merriment.|adjective|The political candidate and his supporters were jovial once it was clear that she had won.
jubilant|full of high-spirited delight because of triumph or success My hardwork paid off, and I was jubilant to receive a perfect score on the GRE.|adjective|jubilant - No example found
juxtapose|place side by side.|verb|The meaning of her paintings comes from a classical style which juxtaposes modern themes.
laconic|one who says very few words.|adjective|While Martha always swooned over the hunky, laconic types in romantic comedies, her boyfriends inevitably were very talkative--and not very hunky.
lambast|criticize severely or angrily.|verb|Showing no patience, the manager utterly lambasted the sales team that lost the big account.
languid|not inclined towards physical exertion or effort; slow and relaxed.|adjective|As the sun beat down and the temperature climbed higher, we spent a languid week lying around the house.
largess|extreme generosity and giving.|noun|Uncle Frank was known for his largess, so his nephew was sad when he did not receive a present for his birthday.
laudable|worthy of high praise.|adjective|To say that Gandhi's actions were laudable is the greatest understatement; he overthrew an empire without violence.
lionize|assign great social importance to.|verb|Students in the U.S. learn to lionize Jefferson, Franklin, and Washington because they are the founding fathers of the nation.
magnanimous|noble and generous in spirit, especially towards a rival or someone less powerful.|adjective|He was a great sportsman: in defeat he was complementary and in victory he was magnanimous.
maintain|to assert.|verb|The scientist maintained that the extinction of dinosaurs was most likely brought about by a drastic change in climate.
maladroit|clumsy.|adjective|As a child she was quite maladroit, but as an adult, she has become an adept dancer. This word has other definitions but this is the most important one for the GRE.
maverick|someone who exhibits great independence in thought and action.|noun|Officer Kelly was a maverick, rarely following police protocols or adopting the conventions for speech common among his fellow officers.
mawkish|overly sentimental to the point that it is disgusting.|adjective|The film was incredibly mawkish, introducing highly likeable characters only to have them succumb to a devastating illnesses by the end of the movie.
mendacity|the tendency to be untruthful.|noun|I can forgive her for her mendacity but only because she is a child and is seeing what she can get away with.
mercurial|(of a person) prone to unexpected and unpredictable changes in mood.|adjective|The fact that Ella's moods were as mercurial as the weather was problematic for her relationships--it didn't help that she lived in Chicago.
meticulous|marked by extreme care in treatment of details.|adjective|The Japanese noodle maker was meticulous in making his noodles and would never let another person take over the task.
misconstrue|interpret in the wrong way.|verb|The politician never trusted journalists because he though that they misconstrue his words and misrepresent his positions.
mitigate|make less severe or harsh.|verb|I can only spend so much time mitigating your disagreements with your wife, and at certain point, you need to do it on your own.
mitigate|lessen the severity of an offense.|verb|If it weren't for the mitigating circumstances, he would have certainly lost his job.
mollify|to make someone angry less angry; placate.|verb|In the morning, Harriat was unable to mollify Harry, if he happened to become angry, unless he had his cup of coffee.
mundane|repetitive and boring; not spiritual.|adjective|Nancy found doing dishes a thorougly mundane task, although Peter found a kind of Zen pleasure in the chore.
mundane|relating to the ordinary world.|adjective|Though we think of the pope as someone always dealing in holy matters, he is also concerned with mundane events, such as deciding when to set his alarm each morning.
munificent|very generous.|adjective|Uncle Charley was known for his munificence, giving all seven of his nephews lavish Christmas presents each year.
myopic|lacking foresight or imagination.|adjective|The company ultimately went out of business because the myopic managers couldn't predict the changes in their industry. This word has other definitions but this is the most important one for the GRE.
myriad|a large indefinite number.|noun|There are a myriad of internet sites hawking pills that claim to boost energy for hours on end.
negligible|so small as to be meaningless; insignificant.|adjective|The GRE tests cumulative knowledge, so if you cram the night before it is, at best, likely to only have a negligible impact on your score.
nonplussed|unsure how to act or respond.|verb|Shirley was totally nonplussed when the angry motorist cut her off and then stuck his finger out the window.
nuance|a subtle difference in meaning or opinion or attitude.|noun|Because of the nuances involved in this case, I hired an outside consultant to advice us and help.
obscure|make unclear.|verb|On the Smith's drive through the Grand Canyon, Mr. Smith's big head obscured much of Mrs. Robinson's view, so that she only saw momentary patches of red rock. This word has other definitions but this is the most important one for the GRE.
obscure|known by only a few.|adjective|Many of the biggest movie stars were once obscure actors who got only bit roles in long forgotten films. This word has other definitions but this is the most important one for the GRE.
obsequious|attentive in an ingratiating or servile manner; attempting to win favor from influential people by flattery.|adjective|The obsequious waiter did not give the couple a moment's peace all through the meal, constantly returning to their table to refill their water glasses and to tell them what a handsome pair they made.
opaque|not clearly understood or expressed.|adjective|The meaning of the professor's new research was opaque to most people, so no one asked any questions. This word has other definitions but this is the most important one for the GRE.
opulence|wealth as evidenced by sumptuous living.|noun|Russian oligarchs are famous for their opulence, living in fancy homes and dining on expensive cavier.
ostentatious|intended to attract notice and impress others; tawdry or vulgar.|adjective|Matt wanted to buy stone lions for front of the house, but Cynthia convinced him that such a display would be too ostentatious for a modest house in an unassuming neighborhood.
ostracize|exclude from a community or group.|verb|Later in his life, Leo Tolstoy was ostracized from the Russian Orthodox Church for his writings that contradicted church doctrine.
panache|distinctive and stylish elegance.|noun|Jim, with his typical panache, came to the wedding reception with a top hat, a cane, and a long cape covered in sequins.
parochial|narrowly restricted in scope or outlook.|adjective|"Jasmine was sad to admit it, but her fledgling relationship with Jacob did not work out because his culinary tastes were simply too parochial; ""After all,"" she quipped on her blog, ""he considered Chef Boyardee ethnic food.""."
parsimonious|extremely frugal; miserly.|adjective|Katie is so parsimonious that she only buys a pair of socks if all of her other socks have holes in them.
pedantic|marked by a narrow focus on or display of learning especially its trivial aspects Professor Thompson was regarded as an expert in his field, but his lectures were utterly pedantic, focused on rigorous details of the most trivial conventions in the field.|adjective|pedantic - No example found
pedestrian|lacking imagination.|adjective|While Nan was always engaged in philosophical speculation, her brother was occupied with far more pedestrian concerns: how to earn a salary and run a household. This word has other definitions but this is the most important one for the GRE.
pejorative|expressing disapproval (usu.|adjective|"refers to a term). Most psychologists object to the pejorative term ""shrink"", believing that they expand the human mind, not limit it. This word has other definitions but this is the most important one for the GRE."
perfidy|an act of deliberate betrayal; a breach of a trust.|noun|The lowest circles in Dante's Inferno were for those who had practiced perfidy, and among these, the very lowest was for those, such as Judas, who had been treacherous to one of their benefactors.
pernicious|exceedingly harmful; working or spreading in a hidden and injurious way The most successful viruses are pernicious: an infected person may feel perfectly healthy for several months while incubating and spreading the virus.|adjective|pernicious - No example found
petulant|easily irritated or annoyed.|adjective|When Ed first met Ruth, he didn't realize she was so petulant, but now that they are three months into their relationship, Ed feels a day doesn't go by in which she isn't whining about some minor issue.
placate|cause to be more favorably inclined; gain the good will of.|verb|I was able to placate the angry mob of students by promising to bring cookies on Monday.
platitude|a trite or obvious remark.|noun|The professor argued that many statements regarded as wise in previous times, such as the Golden Rule, are now regarded as mere platitudes.
poignant|emotionally touching.|adjective|After the Montagues and Capulets discover the dead bodies of Romeo and Juliet, in the play's most poignant moment, the two griefstricken familes agree to end their feud once and for all. This word has other definitions but this is the most important one for the GRE.
polemic|a strong verbal or written attack on someone or something.|noun|The professor launched into a polemic, claiming that Freudian theory was a pack of lies that absolutely destroyed European literary theory. This word has other definitions but this is the most important one for the GRE.
posit|assume as fact.|verb|Initially, Einstein posited a repulsive force to balance Gravity, but then rejected that idea as a blunder.
pragmatic|guided by practical experience and observation rather than theory.|adjective|Rather than make a philosophical appeal to the Congressmen, the Speaker decided to take a far more pragmatic approach, making small side-deals that would add votes to his bill.
precipitous|done with very great haste and without due deliberation.|adjective|"He was expecting a precipitous rise in the value of a ""hot"" tech stock, so he was disappointed when it only inched up a dollar or two each day."
preclude|keep from happening or arising; make impossible.|verb|The manager specified that all other gates be locked, to preclude the possibility of persons without tickets entering the arena undetected.
precocious|characterized by or characteristic of exceptionally early development or maturity (especially in mental aptitude).|adjective|Though only seven years old, she was a precocious chess prodigy, able to beat players twice her age.
predilection|a strong liking.|noun|Monte had a predilection for the fine things in life: Cuban cigars, 200 dollar bottles of wine, and trips to the French Riviera.
prescience|the power to foresee the future.|noun|Baxter's warnings about investing in technology stocks seemed like an act of prescience after the whole market declined significantly.
prevaricate|to speak in an evasive way.|verb|"The cynic quipped, ""There is not much variance in politicians; they all seem to prevaricate""."
prodigal|rashly or wastefully extravagant.|adjective|Successful professional athletes who do not fall prey to prodigality seem to be the exception--most live decadent lives.
prodigious|so great in size or force or extent as to elicit awe.|adjective|"After the relatively small homerun totals in the ""dead ball"" era, Babe Ruth's homerun totals were truly prodigious: every year, he set a new all-time record."
profligate|spending money recklessly or wastefully.|adjective|profligate - No example found
profligate|someone who spends money recklessly or wastefully.|noun|Most lottery winners go from being conservative, frugal types to outright profligates who blow millions on fast cars, lavish homes, and giant yachts.
prolific|intellectually productive.|adjective|Schubert was the most prolific composer, producing hundreds of hours of music before he died at the age of 31.
propitious|presenting favorable circumstances; likely to result in or show signs of success The child's heartbeat is still weak, but I am seeing many propitious signs and I think that she may be healing.|adjective|propitious - No example found
provincial|characteristic of the a limited perspective; not fashionable or sophisticated Maggie's enthusiasm about her high school teams seemed provincial to her college classmates, all of whom were following a nationally ranked college team.|adjective|provincial - No example found
pundit|someone who has been admitted to membership in a scholarly field.|noun|Steven Pinker's credentials are unquestioned as a pundit; he has taught at MIT and Stanford, teaches at Harvard, and has published a number of influential books on cognition, language, and psychology.
qualify|to be legally competent or capable.|adjective|If James had made more than $50,000 last year, then he wouldn't have qualified for the low-income scholarship.
qualify|to make less severe; to limit (a statement).|verb|Chris qualified his love for San Francisco, adding that he didn't like the weather as much as the weather in Los Angeles.
querulous|habitually complaining.|adjective|The querulous old woman was begining to wear down even the happier members of the staff with her ceaseless complaining.
quotidian|found in the ordinary course of events.|adjective|Phil gets so involved thinking about Aristotle's arguments that he totally forgets quotidian concerns, such as exercising and eating regularly.
ravenous|extremely hungry; devouring or craving food in great quantities.|adjective|John didn't each much at all during the week he had the flu, so now that he is regaining his health, it's not surpring that he has a ravenous appetite.
rebuke|criticize severely or angrily; censure.|verb|The police chief rebuked the two officers whose irresponsible decisions almost led to the deaths of seven innocent by-standers.
reconcile|make (one thing) compatible with (another).|verb|Peggy was unable to reconcile her kind friend Jane with the cruel and merciless character Jane played on television.
recondite|difficult to penetrate; incomprehensible to one of ordinary understanding or knowledge.|adjective|I found Ulysses recondite and never finished the book, waiting instead to read it with someone else so we could penetrate its meaning together.
refractory|stubbornly resistant to authority or control.|adjective|Used to studious high school students, Martha was unprepared for the refractory Kindgergarteners who neither sat still nor listened to a single word she said. This word has other definitions but this is the most important one for the GRE.
refute|prove to be false or incorrect.|verb|No one could refute his theories or propositions, and that is why he was esteemed by all his colleagues in the philosophy department.
reproach|to express criticism towards.|verb|At first, Sarah was going to yell at the boy, but she didn't want to reproach him for telling the truth about the situation.
repudiate|reject as untrue or unfounded.|verb|Many in the public believed the rumors of a UFO crash outside town, so the chief of police did everything he could to repudiate the rumors.
rescind|cancel officially.|verb|The man's driver's license was rescinded after his tenth car accident, which meant he would never be allowed to legally drive again.
restive|restless.|adjective|The crowd grew restive as the comedian's opening jokes fell flat.
resurgent|rising again as to new life and vigor.|adjective|The team sank to fourth place in June, but is now resurgent and about to win the division.
reticent|reluctant to draw attention to yourself; temperamentally disinclined to talk When asked about her father, Helen lost her outward enthusiasm and became rather reticent.|adjective|reticent - No example found
reverent|feeling or showing profound respect or veneration.|adjective|The professor could speak objectively about the other composers, but he always lectured about Brahms with a particularly reverent air, unable to offer a single criticism of his compositions.
rudimentary|being in the earliest stages of development; being or involving basic facts or principles.|adjective|I would love to be able to present a fully polished proposal to the board, but right now, our plans for the product are still in the most rudimentary stages.
rustic|characteristic of rural life; awkwardly simple and provincial.|adjective|The vacation cabin had no electricity and no indoor plumbing, but despite these inconveniences, Nigel adored its rustic charm.
sanction|give authority or permission to.|verb|The authorities have sanctioned the use of the wilderness reserve for public use; many expect to see. hikers an campers enjoying the park in the coming months.
